{
  "claim": "الحكومة المصرية رفعت أسعار الوقود بنسبة 50% خلال الشهر الماضي",
  "dialect": "MSA",
  "dialect_confidence": 0.91,
  "query_used": "رفع أسعار الوقود في مصر",
  "verdict_signal": "POSSIBLE_FAKE",
  "final_verdict": "FALSE",
  "confidence": 0.79,
  "bucket_a": [
    {
      "claim": "مصر رفعت أسعار البنزين بنسبة 50% في يوم واحد",
      "similarity": 0.71,
      "label": "FALSE",
      "source": "Misbar",
      "dialect": "MSA",
      "debunk": "لم ترفع الحكومة المصرية أسعار الوقود بهذه النسبة، آخر زيادة كانت 10% فقط."
    }
  ],
  "bucket_b": [
    {
      "proposition": "أعلنت الحكومة المصرية رفع أسعار الوقود بنسبة لا تتجاوز 15% في آخر مراجعة دورية.",
      "proposition_display": "أعلنت الحكومة المصرية رفع أسعار الوقود بنسبة لا تتجاوز 15% في آخر مراجعة دورية.",
      "title": "مراجعة أسعار الوقود في مصر",
      "source": "رويترز عربي",
      "hybrid_score": 0.00145,
      "bm25_rank": 2,
      "e5_rank": 3,
      "rerank_score": 6.2341
    },
    {
      "proposition": "تعتمد لجنة التسعير التلقائي للمنتجات البترولية نسبة زيادة محدودة لا تتخطى 25% في الدورة الواحدة.",
      "title": "آلية التسعير التلقائي للوقود",
      "source": "الأهرام الاقتصادي",
      "hybrid_score": 0.00132,
      "bm25_rank": 5,
      "e5_rank": 4,
      "rerank_score": 4.1188
    },
    {
      "proposition": "نفت وزارة البترول المصرية أي نية لرفع الأسعار بنسبة تتجاوز الخُمس خلال المرحلة القادمة.",
      "title": "وزارة البترول تنفي شائعات الزيادة الكبيرة",
      "source": "وكالة أنباء الشرق الأوسط",
      "hybrid_score": 0.00118,
      "bm25_rank": 8,
      "e5_rank": 7,
      "rerank_score": 2.5402
    }
  ],
  "bucket_b_searched": true
}